{
  "url": "https://github.com/geotools/geotools/pull/4265",
  "project": "geotools",
  "commit": "038fd5fca85abe629d86ce0b1e316999074ad36b",
  "createdAt": "2023-04-15T15:18:07.000+00:00",
  "dependencyGroupID": "org.json",
  "dependencyArtifactID": "json",
  "previousVersion": "20210307",
  "newVersion": "20230227",
  "versionUpdateType": "other",
  "type": "human",
  "reproductionStatus": "not_attempted"
}