{
  "url": "https://github.com/liquibase/liquibase-redshift/pull/121",
  "project": "liquibase-redshift",
  "commit": "683c9e0029129e17c39d554fbf75879ca01d4cbb",
  "createdAt": "2023-02-27T22:12:36.000+00:00",
  "dependencyGroupID": "org.yaml",
  "dependencyArtifactID": "snakeyaml",
  "previousVersion": "1.33",
  "newVersion": "2.0",
  "versionUpdateType": "other",
  "type": "dependabot",
  "reproductionStatus": "not_attempted"
}