{
  "url": "https://github.com/smoketurner/dropwizard-consul/pull/126",
  "project": "dropwizard-consul",
  "commit": "c1e2869d5693048869f5e380566f281be7b69fb2",
  "createdAt": "2020-11-23T06:09:33.000+00:00",
  "dependencyGroupID": "com.orbitz.consul",
  "dependencyArtifactID": "consul-client",
  "previousVersion": "1.4.2",
  "newVersion": "1.5.0",
  "versionUpdateType": "minor",
  "type": "dependabot",
  "reproductionStatus": "not_attempted"
}