{
  "url": "https://github.com/JakeWharton/twirl-maven-plugin/pull/66",
  "project": "twirl-maven-plugin",
  "commit": "3729ebb21e6cb5ca1da1d054f3187b4c4c7dd707",
  "createdAt": "2023-01-02T13:01:26.000+00:00",
  "dependencyGroupID": "org.apache.maven",
  "dependencyArtifactID": "maven-core",
  "previousVersion": "3.6.0",
  "newVersion": "3.8.7",
  "versionUpdateType": "minor",
  "type": "dependabot",
  "reproductionStatus": "not_attempted"
}