{
  "url": "https://github.com/Pante/chimera/pull/413",
  "project": "chimera",
  "commit": "a82ebf2eb1f2f8922191a70c0f95addd2a948fc6",
  "createdAt": "2022-09-28T21:27:07.000+00:00",
  "dependencyGroupID": "org.apache.commons",
  "dependencyArtifactID": "commons-text",
  "previousVersion": "1.9",
  "newVersion": "1.10.0",
  "versionUpdateType": "other",
  "type": "dependabot",
  "reproductionStatus": "not_attempted"
}