{
  "url": "https://github.com/Adyen/adyen-java-api-library/pull/785",
  "project": "adyen-java-api-library",
  "commit": "8831f5e5dc15a7e5ff1f691fe7a90cbcffbc2cda",
  "createdAt": "2022-08-13T13:06:17.000+00:00",
  "dependencyGroupID": "org.mockito",
  "dependencyArtifactID": "mockito-core",
  "previousVersion": "4.6.1",
  "newVersion": "4.7.0",
  "versionUpdateType": "minor",
  "type": "renovate",
  "reproductionStatus": "unreproducible",
  "analysis": {
    "labels": [
      "NO_FAILURE"
    ],
    "javaVersionUsedForReproduction": "11",
    "reproductionLogLocation": "https://github.com/chains-project/breaking-updates/blob/main/reproduction/unreproducible/8831f5e5dc15a7e5ff1f691fe7a90cbcffbc2cda.log"
  }
}