{
  "url": "https://github.com/paulcwarren/spring-content/pull/1386",
  "project": "spring-content",
  "commit": "09b9d23004df07a04d1cdc6a5ae61431c9346f78",
  "createdAt": "2023-04-26T06:59:46.000+00:00",
  "dependencyGroupID": "software.amazon.awssdk",
  "dependencyArtifactID": "s3",
  "previousVersion": "2.17.289",
  "newVersion": "2.20.53",
  "versionUpdateType": "minor",
  "type": "dependabot",
  "reproductionStatus": "not_attempted"
}