{
  "url": "https://github.com/dlsc-software-consulting-gmbh/PreferencesFX/pull/369",
  "project": "PreferencesFX",
  "commit": "63f48f58f46f2e226f66058f1e90aebaf831a0f7",
  "createdAt": "2021-08-25T04:23:06.000+00:00",
  "dependencyGroupID": "org.mockito",
  "dependencyArtifactID": "mockito-core",
  "previousVersion": "3.11.1",
  "newVersion": "3.12.3",
  "versionUpdateType": "minor",
  "type": "dependabot",
  "reproductionStatus": "unreproducible",
  "analysis": {
    "labels": [
      "PRECEDING_COMMIT_COMPILATION_FAILURE"
    ],
    "javaVersionUsedForReproduction": "11",
    "reproductionLogLocation": "https://github.com/chains-project/breaking-updates/blob/main/reproduction/unreproducible/63f48f58f46f2e226f66058f1e90aebaf831a0f7.log"
  }
}