{
  "url": "https://github.com/FluentLenium/FluentLenium/pull/1216",
  "project": "FluentLenium",
  "commit": "b16fffef3391b0dad11613d5f44934b657e7710d",
  "createdAt": "2021-03-10T02:14:26.000+00:00",
  "dependencyGroupID": "net.bytebuddy",
  "dependencyArtifactID": "byte-buddy",
  "previousVersion": "1.10.14",
  "newVersion": "1.10.22",
  "versionUpdateType": "patch",
  "type": "dependabot",
  "reproductionStatus": "not_attempted"
}