{
  "url": "https://github.com/artipie/docker-adapter/pull/514",
  "project": "docker-adapter",
  "commit": "da616b08bed87397264691470f47638652f0015a",
  "createdAt": "2022-05-23T17:12:58.000+00:00",
  "dependencyGroupID": "com.artipie",
  "dependencyArtifactID": "asto",
  "previousVersion": "v1.8.0",
  "newVersion": "v1.12.0",
  "versionUpdateType": "other",
  "type": "dependabot",
  "reproductionStatus": "not_attempted"
}