{
  "url": "https://github.com/oldstuffs/configs/pull/332",
  "project": "configs",
  "commit": "a6baf0d53864c9bf3387ffa85caa24b68ad430d5",
  "createdAt": "2021-05-03T09:17:42.000+00:00",
  "dependencyGroupID": "io.github.portlek",
  "dependencyArtifactID": "replaceable",
  "previousVersion": "2.2.1",
  "newVersion": "2.2.2",
  "versionUpdateType": "patch",
  "type": "dependabot",
  "reproductionStatus": "not_attempted"
}