{
  "url": "https://github.com/quarkusio/quarkus-platform/pull/756",
  "project": "quarkus-platform",
  "commit": "d0461563fdb1ed17801fc4c8fcb96792779db303",
  "createdAt": "2023-01-24T12:59:14.000+00:00",
  "dependencyGroupID": "org.testng",
  "dependencyArtifactID": "testng",
  "previousVersion": "6.14.2",
  "newVersion": "7.7.0",
  "versionUpdateType": "major",
  "type": "dependabot",
  "reproductionStatus": "not_attempted"
}