{
  "url": "https://github.com/Ghost-chu/QuickShop-Hikari/pull/790",
  "project": "QuickShop-Hikari",
  "commit": "a703497b17e874002d83a349420c7afdd509cde4",
  "createdAt": "2023-02-28T19:08:05.000+00:00",
  "dependencyGroupID": "com.palmergames.bukkit.towny",
  "dependencyArtifactID": "towny",
  "previousVersion": "0.98.6.4",
  "newVersion": "0.98.6.9",
  "versionUpdateType": "other",
  "type": "dependabot",
  "reproductionStatus": "not_attempted"
}