{
  "url": "https://github.com/knowm/XChange/pull/4261",
  "project": "XChange",
  "commit": "dd22e7ab7a8b188e07e3567964aeb87d6791284a",
  "createdAt": "2021-09-07T12:09:39.000+00:00",
  "dependencyGroupID": "com.github.tomakehurst",
  "dependencyArtifactID": "wiremock-jre8",
  "previousVersion": "2.30.1",
  "newVersion": "2.31.0",
  "versionUpdateType": "minor",
  "type": "dependabot",
  "reproductionStatus": "not_attempted"
}