{
  "url": "https://github.com/smallrye/smallrye-graphql/pull/1209",
  "project": "smallrye-graphql",
  "commit": "66ce02449f96269ddfa2e92789e3085673209fb7",
  "createdAt": "2021-12-06T19:12:53.000+00:00",
  "dependencyGroupID": "org.apache.maven.plugin-tools",
  "dependencyArtifactID": "maven-plugin-annotations",
  "previousVersion": "3.6.1",
  "newVersion": "3.6.2",
  "versionUpdateType": "patch",
  "type": "dependabot",
  "reproductionStatus": "unreproducible",
  "analysis": {
    "labels": [
      "PRECEDING_COMMIT_TEST_FAILURE"
    ],
    "javaVersionUsedForReproduction": "11",
    "reproductionLogLocation": "https://github.com/chains-project/breaking-updates/blob/main/reproduction/unreproducible/66ce02449f96269ddfa2e92789e3085673209fb7.log"
  }
}