{
  "url": "https://github.com/TAKETODAY/today-infrastructure/pull/93",
  "project": "today-infrastructure",
  "commit": "b1db8931a73b949dfa2eb5f453b2ca87608d896c",
  "createdAt": "2021-12-15T11:09:33.000+00:00",
  "dependencyGroupID": "org.apache.logging.log4j",
  "dependencyArtifactID": "log4j-core",
  "previousVersion": "2.15.0",
  "newVersion": "2.16.0",
  "versionUpdateType": "minor",
  "type": "dependabot",
  "reproductionStatus": "not_attempted"
}