{
  "url": "https://github.com/zalando/logbook/pull/1262",
  "project": "logbook",
  "commit": "0adb9364b8279f40bbb756d1a2c8831de3dca491",
  "createdAt": "2021-12-29T04:01:01.000+00:00",
  "dependencyGroupID": "org.organicdesign",
  "dependencyArtifactID": "Paguro",
  "previousVersion": "3.1.4",
  "newVersion": "3.8.0",
  "versionUpdateType": "minor",
  "type": "dependabot",
  "reproductionStatus": "unreproducible",
  "analysis": {
    "labels": [
      "PRECEDING_COMMIT_COMPILATION_FAILURE"
    ],
    "javaVersionUsedForReproduction": "11",
    "reproductionLogLocation": "https://github.com/chains-project/breaking-updates/blob/main/reproduction/unreproducible/0adb9364b8279f40bbb756d1a2c8831de3dca491.log"
  }
}