{
  "url": "https://github.com/openrewrite/rewrite-maven-plugin/pull/53",
  "project": "rewrite-maven-plugin",
  "commit": "ea4cf7e2ef21b3a83963e696cc0d0aafdd6e5464",
  "createdAt": "2020-09-21T06:20:38.000+00:00",
  "dependencyGroupID": "org.junit.vintage",
  "dependencyArtifactID": "junit-vintage-engine",
  "previousVersion": "5.6.2",
  "newVersion": "5.7.0",
  "versionUpdateType": "minor",
  "type": "dependabot",
  "reproductionStatus": "not_attempted"
}