{
  "url": "https://github.com/Marketcetera/marketcetera/pull/1040",
  "project": "marketcetera",
  "commit": "6d31a6f8bfe73f14b54e6c1ffda0f197e5414c32",
  "createdAt": "2022-11-10T02:23:01.000+00:00",
  "dependencyGroupID": "org.tmatesoft.svnkit",
  "dependencyArtifactID": "svnkit",
  "previousVersion": "1.10.6",
  "newVersion": "1.10.9",
  "versionUpdateType": "patch",
  "type": "dependabot",
  "reproductionStatus": "not_attempted"
}