{
  "url": "https://github.com/paulcwarren/spring-content-examples/pull/523",
  "project": "spring-content-examples",
  "commit": "cb84f2dcdfc494a925c664840e58c6275c6a4d9b",
  "createdAt": "2022-07-05T22:12:05.000+00:00",
  "dependencyGroupID": "software.amazon.awssdk",
  "dependencyArtifactID": "s3",
  "previousVersion": "2.17.182",
  "newVersion": "2.17.225",
  "versionUpdateType": "patch",
  "type": "dependabot",
  "reproductionStatus": "not_attempted"
}