{
  "url": "https://github.com/apache/iotdb/pull/6849",
  "project": "iotdb",
  "commit": "3a90b7dfbfa19a07b10bedca54d4fd2dbd51d92d",
  "createdAt": "2022-08-01T00:15:05.000+00:00",
  "dependencyGroupID": "com.github.ben-manes.caffeine",
  "dependencyArtifactID": "caffeine",
  "previousVersion": "2.9.1",
  "newVersion": "2.9.3",
  "versionUpdateType": "patch",
  "type": "dependabot",
  "reproductionStatus": "unreproducible",
  "analysis": {
    "labels": [
      "PRECEDING_COMMIT_COMPILATION_FAILURE"
    ],
    "javaVersionUsedForReproduction": "11",
    "reproductionLogLocation": "https://github.com/chains-project/breaking-updates/blob/main/reproduction/unreproducible/3a90b7dfbfa19a07b10bedca54d4fd2dbd51d92d.log"
  }
}