{
  "url": "https://github.com/TeamKun/TeamKUNPluginManager/pull/67",
  "project": "TeamKUNPluginManager",
  "commit": "c11a1e8b5950fe274f126e7b3b529582050814b7",
  "createdAt": "2022-01-10T20:09:30.000+00:00",
  "dependencyGroupID": "com.zaxxer",
  "dependencyArtifactID": "HikariCP",
  "previousVersion": "4.0.3",
  "newVersion": "5.0.1",
  "versionUpdateType": "major",
  "type": "dependabot",
  "reproductionStatus": "not_attempted"
}