{
  "url": "https://github.com/apache/isis/pull/331",
  "project": "isis",
  "commit": "99da0e17f76339c74ead8dc7c3dda55f4b8aaeaf",
  "createdAt": "2021-01-15T06:20:01.000+00:00",
  "dependencyGroupID": "org.eclipse.persistence",
  "dependencyArtifactID": "org.eclipse.persistence.sdo",
  "previousVersion": "2.7.7",
  "newVersion": "2.7.8",
  "versionUpdateType": "patch",
  "type": "dependabot",
  "reproductionStatus": "not_attempted"
}