{
  "url": "https://github.com/googleapis/java-bigquery/pull/2468",
  "project": "java-bigquery",
  "commit": "30657443a9bd90d181871c958a8534a4953f5a2b",
  "createdAt": "2023-01-14T10:22:03.000+00:00",
  "dependencyGroupID": "org.mockito",
  "dependencyArtifactID": "mockito-core",
  "previousVersion": "4.11.0",
  "newVersion": "5.1.0",
  "versionUpdateType": "major",
  "type": "renovate",
  "reproductionStatus": "not_attempted"
}